<!ELEMENT student (roll_no,name,address,mobile,dob,age,qualification)>
<!ELEMENT roll_no (#PCDATA)>
<!ELEMENT name (#PCDATA)>
<!ELEMENT address (#PCDATA)>
<!ELEMENT mobile (#PCDATA)>
<!ELEMENT dob (#PCDATA)>
<!ELEMENT age (#PCDATA)>
<!ELEMENT qualification (#PCDATA)>